{
    "title": "title (test 0 + 1 )",
    "version": "1.2.3",
    "status": "Unknown",
    "experimental": true,
    "artifact_type": "Data Summary",
    "creation_date": "2018-11-01T01:19:50Z",
    "creation_and_usage": {
        "license": "GPL",
        "keywords": [ "key1", "key2", "key3" ]
    },
    "testing_experience" : {
        "pilot_experience": "excellent"
    }
}